,Post_Content,Date,Comments_Shares,All_Responses,Brand
9,The Christmas lights can wait. #TooGoodToWait https://bit.ly/2ABcbLT,December 10 at 6:15 AM,3 Comments9 Shares10K Views,101,waitroseandpartners
11,"Our raspberry gin cocktail is a delicious festive tipple.
Sprinkle with Cooks' Ingredients Raspberry Dust to finish.
Recipe: https://bit.ly/2Rd4EKF",December 8 at 12:00 PM,113 Comments52 Shares16K Views,286,waitroseandpartners
12,Playing charades can wait. #TooGoodToWait https://bit.ly/2BHaWg6,December 6 at 6:15 AM,16 Comments23 Shares9.7K Views,123,waitroseandpartners
14,"Who's baking this weekend for Stir-up Sunday?
Martha Collison's spiced rum and white chocolate Christmas cake is the ultimate festive bake.
Recipe: https://bit.ly/2OX0tQR",November 24 at 10:00 AM,87 Comments37 Shares24K Views,313,waitroseandpartners
16,Watching Christmas ads can wait. #TooGoodToWait https://bit.ly/2Kj1i68,November 19 at 10:15 AM,121 Comments273 Shares32K Views,628,waitroseandpartners
18,"Sometimes even true love can wait. #TooGoodToWait
https://bit.ly/2z7jsn4",November 14 at 10:15 AM,34 Comments38 Shares13K Views,165,waitroseandpartners
20,"Singing jingle bells can wait. #TooGoodToWait
https://bit.ly/2zSE4Pe",November 13,24 Comments37 Shares12K Views,180,waitroseandpartners
22,"Our prosecco and cranberry cocktail is the ultimate spooky showstopper!
Remove the Cointreau and swap the fizz for lemonade to make it suitable for kids too.
Recipe: https://bit.ly/2RjIMgh",October 26,161 Comments74 Shares29K Views,285,waitroseandpartners
26,"Our new #beautifullysimple Gujarati-style sweet potato curry is both simple to shop and simple to cook.
Pick up all the ingredients in store from the Beautifully Simple chiller at your local Waitrose & Partners now.
Find out more: https://bit.ly/2pOmdnS",October 18,74 Comments35 Shares13K Views,151,waitroseandpartners
28,"Our new black garlic is one of 100 lines added to our Cook's Ingredients range.
Sweet and syrupy with hints of balsamic vinegar it's delicious served on toasted bruschetta with sundried tomatoes.
Explore the new range: https://bit.ly/2DEpMH9",October 1,202 Comments100 Shares183K Views,684,waitroseandpartners
30,"Our new #beautifullysimple mango chicken, cashew & coconut rice stir fry is both simple to shop and simple to cook.
Pick up all the ingredients in store from the Beautifully Simple chiller at your local Waitrose & Partners now.
Find out more: https://bit.ly/2xQIs0a",September 26,47 Comments27 Shares10K Views,168,waitroseandpartners
32,"All our fruit and veg bags will be home compostable by spring 2019. Our 5p single-use carrier bags will also be removed from all shops by March 2019.
In total this will save 134 million plastic bags, the equivalent of 500 tonnes of plastic a year.
Find out more about how we’re reducing our impact on the environment: https://bit.ly/2MWHxFZ",September 15,"757 Comments1,594 Shares",15K,waitroseandpartners
34,"Ready in just 8 minutes, our rainbow tofu bowl is low in saturated fat and a tasty vegan dinner.
Recipe: https://bit.ly/2wYylab",September 13,12 Comments22 Shares8.2K Views,103,waitroseandpartners
36,"Ready in just 8 minutes, our rainbow tofu bowl is low in saturated fat and a tasty vegan dinner.
Recipe: https://bit.ly/2wYylab",September 13,137 Comments112 Shares325K Views,1K,waitroseandpartners
38,Discover behind the scenes and the making of the Bohemian Rhapsody Waitrose & Partners + John Lewis & Partners ad 🌩️ 🚀 🎤,September 8,93 Comments160 Shares31K Views,476,waitroseandpartners
44,"Three delicious ways to enjoy spinach. Which recipe will you try?
Sesame: https://bit.ly/2OAyLtJ
Breakfast smoothie: https://bit.ly/2KNVjVn
Spinach, chicken & walnut salad: https://bit.ly/2Mj4sKq",August 27,126 Comments365 Shares416K Views,1.2K,waitroseandpartners
46,The ultimate weekend treat using our irresistible Waitrose 1 Summer Blush Strawberries: https://bit.ly/2nql8S8,August 17,457 Comments577 Shares,1K,waitroseandpartners
48,"Our exclusive Waitrose 1 Summer Blush Strawberries are a seasonal sensation.
With their intense flavour, these are British strawberries at their best.
Shop in store or online now: https://bit.ly/2nDGFXL",August 17,65 Comments30 Shares176K Views,891,waitroseandpartners
50,"Ready in 30 minutes this lovely, colourful pasta dish is an easy midweek meal livened up with a kick of chilli.
Recipe: https://bit.ly/2vCnemE",August 15,686 Comments851 Shares459K Views,3.1K,waitroseandpartners
52,"Our recipe for cauliflower antipasti salad is ready in just 10 minutes and 2 simple steps, making it perfect for a quick and easy midweek meal.
Recipe: https://bit.ly/2vo3RNP",August 8,220 Comments326 Shares333K Views,1.3K,waitroseandpartners
54,"From tasty antipasti and pizzas, to our finest Waitrose 1 pastas explore our range of delicious Italian food and drink.
Shop in store or online now: https://bit.ly/2O3QSYx",August 3,44 Comments32 Shares207K Views,382,waitroseandpartners
56,"Ready in under 25 minutes, our massaman lamb cutlets make for a quick dinner. Serve with peanut green beans to complete this quick and easy dish. Recipe: https://bit.ly/2NRfFyO",August 1,326 Comments497 Shares584K Views,1.6K,waitroseandpartners
58,"In the coming weeks, we're removing disposable takeaway cups from branches in your local area to reduce plastic and packaging waste.
Remember to bring your reusable cup when you get your myWaitrose tea or coffee. #KeepYourCup
Find out more: https://bit.ly/2LeF8pc",July 30,264 Comments854 Shares87K Views,2.2K,waitroseandpartners
60,"Grilled fruit intensifies flavours by caramelising the natural sugars. Try this tasty trick this summer and serve in a salad, as a side or as an after dinner treat. Shop now: https://bit.ly/2JNTabW",July 26,26 Comments35 Shares16K Views,110,waitroseandpartners
62,Ready in just 15 minutes our zingy prawn & charred gem salad is a simple and light summer dish. Recipe: https://bit.ly/2us2mxN,July 23,189 Comments317 Shares452K Views,1.4K,waitroseandpartners
64,"Tonight doesn't need to be any more stressful. Our quick and easy recipe for pulled pork nachos is perfect for keeping your eyes on the game. Recipe: https://bit.ly/2tVmYOC
#ItsComingHome!",July 11,377 Comments308 Shares330K Views,1.1K,waitroseandpartners
66,Our recipe for burrata salad with dukkah is ready in just 20 mins - perfect for a quick weekday meal. Recipe: https://bit.ly/2KRzuVT,July 9,347 Comments419 Shares553K Views,1.8K,waitroseandpartners
68,"British strawberries, broken meringue and whipped cream - our Eton Mess makes for a truly indulgent summertime treat. Recipe: https://bit.ly/2tLyjAG",July 6,26 Comments52 Shares19K Views,250,waitroseandpartners
70,"Our seared halloumi with strawberry, chickpea and chilli salsa is ready in only 25 minutes. Ready in just 3 steps it's a quick and easy summer meal. Recipe: https://bit.ly/2K6v9S9",July 4,"1.2K Comments1,473 Shares620K Views",3.5K,waitroseandpartners
72,"Enjoy 3 for £10 on a selection of our barbecue lines, from harissa and date lamb kebabs to chorizo style sausage whorls - perfect for the weekend heatwave.
Shop in store or online: https://bit.ly/2lqIfLs",June 29,14 Comments17 Shares16K Views,98,waitroseandpartners
74,"Ready in just 25 mins, try our 3-step recipe for Sizzling lamb with courgette couscous. Recipe: https://bit.ly/2yquCVV",June 28,411 Comments445 Shares378K Views,1.5K,waitroseandpartners
76,"Try our recipe for Saffron chicken with lemon and olives, with just 3 steps and only 6 ingredients. Find out more: https://bit.ly/2K77joE",June 27,198 Comments577 Shares417K Views,1.7K,waitroseandpartners
78,"Easy to prepare and cooked in only 35 minutes, wild Alaskan salmon makes for a healthier dinner that’s high in omega 3. Serve with tray-baked veg and extra dill for flavour. Recipe https://bit.ly/2K3igrh",June 25,202 Comments518 Shares574K Views,2.4K,waitroseandpartners
80,Our recipe for Keralan green bean curry is tasty and ready in just 30 minutes. It's also gluten free and vegan. Recipe: https://bit.ly/2JOaNJv,June 21,280 Comments504 Shares508K Views,1.5K,waitroseandpartners
82,Who’s seen our exciting new vegetarian and vegan range? With 60% more choice there is lots to enjoy. Shop in store or online: https://bit.ly/2JJfkB2,June 19,786 Comments356 Shares434K Views,2.1K,waitroseandpartners
84,"Whatever your plans this weekend, enjoy 20% off selected items in our new barbecue and pizza ranges. Shop in store and online now: https://bit.ly/2y736fZ",June 15,26 Comments52 Shares332K Views,750,waitroseandpartners
86,Whatever your plans this weekend enjoy 20% off a selection of our barbecue range and new pizzas. Shop instore or online now: https://bit.ly/2y736fZ,June 15,8 Comments6.5K Views,50,waitroseandpartners
88,"Looking for #beautifullysimple dinner inspiration? Try our chicken harissa meatball one-pot recipe, made with seven ingredients and ready in three steps. Find out more: https://bit.ly/2xqUsZf",June 6,260 Comments396 Shares521K Views,1.7K,waitroseandpartners
90,Enjoy a healthier sweet treat with our delicious banana and strawberry frozen yogurt. Recipe: https://bit.ly/2H8lCE3,June 4,"424 Comments1,747 Shares611K Views",4.3K,waitroseandpartners
92,"Three delicious ways to cook with British new potatoes. Which recipe will you try?
Gratin with bacon and watercress: https://bit.ly/2IAVmYC
Spiced: https://bit.ly/2x1XH9q
Potato salad: https://bit.ly/2kgtdHG",May 29,"590 Comments2,042 Shares956K Views",3.7K,waitroseandpartners
94,Congratulations to the happy couple from all of us at Waitrose #RoyalWedding,May 19,173 Comments196 Shares375K Views,5.9K,waitroseandpartners
96,"Try our recipe for a zesty lemon and elderflower roulade, inspired by the flavours of the #RoyalWedding cake: https://bit.ly/2Ig4PjA",May 17,224 Comments238 Shares444K Views,1.2K,waitroseandpartners
100,"Try our #beautifullysimple 7 ingredient recipe for carrots, feta & grains with pomegranate molasses. It's made with our Cooks' Ingredients zaatar spice blend, so it's packed full of flavour.
Find out more: https://bit.ly/2KerWff",May 16,173 Comments202 Shares389K Views,1.1K,waitroseandpartners
102,"Start the week with our 10-minute recipe for #beautifullysimple gazpacho with goat's cheese & sourdough. Pick up the ingredients in store.
Find out more: https://bit.ly/2HWZ39E",May 14,196 Comments253 Shares432K Views,1.3K,waitroseandpartners
104,"British asparagus is in season now. Try our simple 3 step recipe with an almond sauce for a lovely light lunch.
Find the recipe here: https://bit.ly/2rkTJDu",May 4,251 Comments348 Shares286K Views,1.8K,waitroseandpartners
106,"What to cook tonight? Try our delicious prawn spaghetti lunghi with lime & chilli. Made from the best fresh ingredients and with only three steps.
Pick up the ingredients at your local Waitrose now.
Find out more: https://bit.ly/2EQTljZ",April 28,114 Comments97 Shares30K Views,461,waitroseandpartners
108,"Our delicious Bucatini pasta with oven-roasted tomatoes and basil is a #beautifullysimple recipe, made from the best fresh ingredients and with only three steps.
Pick up the ingredients at your local Waitrose now.
Find out more: https://bit.ly/2qC8DE7",April 22,57 Comments91 Shares26K Views,414,waitroseandpartners
110,"Have you seen our new #beautifullysimple recipes?
Recreate them at home and share your photos below for the chance to win a range of exciting foodie prizes including courses at the Waitrose Cookery School in London.
Recipes and T&Cs: https://bit.ly/2HAIxcN",April 21,14 Comments8 Shares,95,waitroseandpartners
112,"Roasted, mashed or Sriracha-fried? Try one of these delicious recipes using essential Waitrose cauliflower.
Find all three recipes here: http://bit.ly/2HbEW7j",April 12,"1K Comments2,539 Shares1.1M Views",5.3K,waitroseandpartners
114,"We're removing all disposable takeaway cups from our shops by the autumn.
You can still enjoy a free cup of tea or coffee when you shop with us; remember to bring your own reusable cup and your myWaitrose card with you.
#KeepYourCup 💚 ...
See More",April 10,"4.8K Comments13,373 Shares1.2M Views",40K,waitroseandpartners
118,"We hope you're enjoying your weekend! Just to let you know, our shops and Customer Care team are closed on Easter Sunday but we will be back on Easter Monday.",March 31,40 Comments10 Shares,247,waitroseandpartners
120,Enjoy a third off roasts and all the trimmings for the perfect Easter dinner with family. Available in store and online: https://bit.ly/2pw1INb,March 30,23 Comments12 Shares15K Views,95,waitroseandpartners
122,"Win a family picnic hamper filled with Waitrose 1 treats, plus an annual National Trust pass for the whole family!
Simply post photos in the comments below of all the delicious food you’re enjoying this Easter.
T&Cs: http://bit.ly/2IKVCjW",March 29,657 Comments498 Shares,10K,waitroseandpartners
126,"Our diamond-shaped, hand-decorated Waitrose 1 eggs are a jewel in the crown of our Easter range. They also come with six indulgent fleur de sel salted caramels for a decadent treat.
Shop in store and online now: http://bit.ly/2FJlfUB",March 22,262 Comments219 Shares445K Views,2.1K,waitroseandpartners
128,"Our Chocolate Avocado Easter eggs are nearly gone, but don't worry, we’ve got ten to give away!
Comment below telling us who you'd give yours to if you won, or if you would simply keep it all to yourself!
Shop in store and online for the rest of our fantastic Easter range....
See More",March 21,8.9K Comments961 Shares791K Views,5K,waitroseandpartners
130,"For a one-pot dish that’s bursting with flavour, try our sweet potato, date and aubergine tagine recipe: http://bit.ly/2Fxx2ks
This delicious recipe is made using essential Waitrose ingredients with the quality you’d expect from us, at prices you wouldn’t: http://bit.ly/2IdElzU",March 19,"524 Comments1,268 Shares459K Views",3.3K,waitroseandpartners
132,"Warming with bubbling cheese, our essential Waitrose butternut mac and cheese recipe is ready in just 25 minutes: http://bit.ly/2pgrlRk",March 16,806 Comments651 Shares365K Views,2.5K,waitroseandpartners
134,"Scrumptious turkey meatballs with tagliatelle, chilli and tomato for a quick supper that's ready in 25 minutes: http://bit.ly/2Ddgmgl
This recipe is made using essential Waitrose ingredients with the quality you’d expect from us, at prices you wouldn’t: http://bit.ly/2IdElzU",March 13,146 Comments429 Shares327K Views,1.4K,waitroseandpartners
136,"Three delicious ways to cook with essential Waitrose broccoli, just 59p! Which one will you try?
Broccoli with olives and feta: http://bit.ly/2FpgDTq
Sautéed Broccoli with sesame and garlic: http://bit.ly/2FqeiDG
Roasted broccoli steaks with salsa verde: http://bit.ly/2DaVzu1",March 12,458 Comments552 Shares397K Views,1.8K,waitroseandpartners
138,"That’s brunch sorted!
This delicious recipe is made using essential Waitrose ingredients with the quality you’d expect from us, at prices you wouldn’t: http://bit.ly/2IdElzU",March 10,"2K Comments3,595 Shares1.8M Views",11K,waitroseandpartners
140,"Try our irresistible Grapefruit G&T cake with sticky gin drizzle and candied grapefruit slices – perfect for a gin-lover!
Read the recipe: http://bit.ly/2Fgqz0D",March 2,2.6K Comments847 Shares668K Views,2.7K,waitroseandpartners
142,"Win a beautiful Peach Melba Bouquet! Simply comment below and tell us how you're saying #ThanksMum this Mother’s Day.
T&Cs: http://bit.ly/2EXmmvx",February 28,1.3K Comments629 Shares,10K,waitroseandpartners
146,"Watch how to make John Whaite’s deliciously tart goat’s cheese, rhubarb and thyme cheesecake – the perfect way to make the most of seasonal rhubarb.
Recipe: http://bit.ly/2nTvsCR",February 17,84 Comments197 Shares303K Views,864,waitroseandpartners
148,"Introducing…our Avocado Easter egg 🥑
It has a delicious dark chocolate shell, white chocolate 'flesh' and an inner cocoa-dusted 'stone'.
Shop in store and online from 20 February.",February 16,"17K Comments1,723 Shares",12K,waitroseandpartners
150,"Celebrate this Valentine’s Day in style with our delicious strawberry and rhubarb cosmopolitan.
Get recipe: http://bit.ly/2nZVdRm
drinkaware.co.uk for the facts.",February 14,103 Comments141 Shares199K Views,929,waitroseandpartners
152,"Enjoy these delicious topping ideas for Pancake Day! Which one is your favourite; mango mojito, maple butter and crispy pancetta or chocolate, banana and hazelnut?
Read the recipe: http://bit.ly/2EyGZB1",February 13,191 Comments442 Shares522K Views,933,waitroseandpartners
156,"Say 'I Iove you' with Waitroses this Valentine's.
Pop in store to discover our range of beautiful roses starting from just £5.
Selected stores and lines. Subject to availability. In-store only.",February 12,59 Comments47 Shares285K Views,661,waitroseandpartners
158,"Watch how to cook the perfect steak with three delicious serving suggestions, béarnaise sauce, chimichurri and chipotle spiced butter.
Get the recipe: http://bit.ly/2Eafpqw",February 11,136 Comments425 Shares286K Views,969,waitroseandpartners
160,"Cook up a little romance with our £20 Valentine’s Dinner for Two. Choose a starter, main, 2 sides, dessert and either fizz, wine or chocolates. A tasty treat for a quiet night in.",February 10,181 Comments65 Shares,1.2K,waitroseandpartners
162,Discover our Red Rose Guide and surprise a loved one this Valentines with a beautiful bouquet: http://bit.ly/2nIevew,February 9,8 Comments9 Shares,97,waitroseandpartners
164,"Win two of our beautiful ‘My True Love’ bouquets! Simply comment below, who you’d give yours to if you won - yourself or a loved one?
Terms: http://bit.ly/2EaBm8Y
Visit us in store with a range of lovely roses starting from £5, or browse our range of Waitrose Florist Valentine’s bouquets here: http://bit.ly/2E2LUL9",February 7,2.4K Comments374 Shares,2.1K,waitroseandpartners
166,"Watch how to make these delicious little chocolate bites, made with a cashew, coconut and date base.
Read the full recipe: http://bit.ly/2ndwOYM",February 3,66 Comments94 Shares30K Views,415,waitroseandpartners
168,"Rich in vitamin C, carrots are immensely versatile and delicious in many different dishes. Why not try one of these recipes tonight?
Warm carrot, apple & crispy kale salad: http://bit.ly/2DP0oNK
Peanut carrot noodles: http://bit.ly/2DHbLZ1...
See More",February 1,21 Comments36 Shares16K Views,118,waitroseandpartners
170,Keep an eye out for the Good Health label on Waitrose products and recipes. It's one of the ways we're helping you make healthier choices. Find out more: waitrose.com/goodhealth,January 28,15 Comments7 Shares12K Views,114,waitroseandpartners
172,"Enjoy more veg with these delicious stir-fry recipes, all ready in under 25 minutes.
Which one will you try?
Sichuan pepper & tofu stir-fry: http://bit.ly/2Dmu1qf...
See More",January 26,98 Comments321 Shares218K Views,835,waitroseandpartners
174,Celebrate Burns Night with our crispy haggis bon bons. Serve with drizzle of whisky sauce. Recipe: http://bit.ly/2DoXobD,January 25,53 Comments804 Shares,150,waitroseandpartners
178,"Keep to your January goals with our #30DaysOfHealth challenge!
Terms: waitrose.com/30DaysOfHealth",January 22,39 Comments4 Shares2K Views,37,waitroseandpartners
180,Keep an eye out for the Good Health label on Waitrose products and recipes. It's one of the ways we're helping you make healthier choices. Find out more: http://bit.ly/2CVU2ww,January 21,8 Comments15 Shares15K Views,143,waitroseandpartners
182,"Deliciously rich double chocolate cookies that are also gluten-free and vegan!
Get the recipe: http://bit.ly/2DpMtLF",January 20,1.3K Comments317 Shares693K Views,1K,waitroseandpartners
184,"Three quick and delicious soup recipes for lunch and dinner. Which is your favourite?
Simple vegetable soup: http://bit.ly/2EAWS6i
Spiced cannellini and lentil soup: http://bit.ly/2EBC3rw...
See More",January 17,311 Comments781 Shares311K Views,1.4K,waitroseandpartners
188,"During January we'll be helping you keep to your healthier goals in our #30DaysOfHealth challenge!
This week, we want to see photos of your healthier soups and casseroles. Share your photos below, and you and a friend could win a Cuisinart Soup Maker Plus
Terms: waitrose.com/30DaysOfHealth",January 15,42 Comments6 Shares2.4K Views,49,waitroseandpartners
194,"This week, it's Challenge Two of our #30DaysOfHealth challenge. We'd love to see photos of your healthier breakfast dishes. Comment below with your healthier breakfast photos and you and a friend could win a Nutribullet.
Terms: http://bit.ly/2Ax1J64",January 8,42 Comments6 Shares2.8K Views,45,waitroseandpartners
196,"Here are three tasty ways to include more fruit and veg in your diet.
Click for the recipes:
Spiced veggie shepherd's pie: http://bit.ly/2E4qyZp
Butternut and ricotta lasagne: http://bit.ly/2E7p2Wp...
See More",January 5,263 Comments418 Shares353K Views,1.1K,waitroseandpartners
198,"Have you tried our #30DaysOfHealth challenge? We're setting a series of tasks to help you keep to your healthier goals, and by taking part you have the chance to win a prize.
This week's challenge is to 'eat the rainbow' - we'd love to see your deliciously vibrant and colourful healthier meals.
Comment below with photos, and you and a friend could win one month’s subscription to our recipe box service, Cook Well from Waitrose. ...


See More",January 5,12 Comments3 Shares1.5K Views,23,waitroseandpartners
200,Keep an eye out for the Good Health label on Waitrose products and recipes. It's one of the ways we're helping you make healthier choices. Find out more... http://bit.ly/2CF5TOo,January 4,16 Comments13 Shares12K Views,206,waitroseandpartners
202,"For the next 30 days, we'll be helping you keep to your healthier goals in our #30DaysOfHealth challenge!
This week, we want to see photos of your deliciously vibrant and colourful meals. Comment below with photos and you and a friend could win one month’s subscription to our recipe box service, Cook Well from Waitrose.
Cook Well: http://bit.ly/2lMv1IF
Terms: http://bit.ly/2CL6nAd",January 3,53 Comments20 Shares,178,waitroseandpartners
206,"Wishing everyone a Happy New Year!
We’re now closed and off to enjoy the celebrations! Our customer care team will be back from 8am on Tuesday 2 January.","December 31, 2017",40 Comments12 Shares,584,waitroseandpartners
208,"Celebrate New Year’s Eve with one of these sparkling cocktails:
- Stollen fizz: http://bit.ly/2iYsZnN
- Classic Champagne cocktail: http://bit.ly/2AhFjGT
- Passion fruit Bellini: http://bit.ly/2z9mo2R...
See More","December 30, 2017",299 Comments368 Shares326K Views,1.2K,waitroseandpartners
210,"Don’t let the leftovers go to waste; try one of these delicious recipes!
- Nutty baked apples: http://bit.ly/2jfi0qP
- Stilton red onion walnut pizza: http://bit.ly/2ih4P7G
- Turkey biryani with red onion and coriander: http://bit.ly/2AT0kf1","December 26, 2017",424 Comments771 Shares757K Views,1.3K,waitroseandpartners
212,"Merry Christmas from all of us at Waitrose!
Thank you to everyone who took part in sharing #ChristmasTogether videos and photos, we’ve loved seeing them.","December 25, 2017",55 Comments90 Shares1.1M Views,2.9K,waitroseandpartners
214,"We hope you all have a fantastic Christmas, our Facebook wall is now closed, but our customer care team will be back at 9am on Wednesday 27 December to hear all about the amazing food you’ve been enjoying.
Merry Christmas from all of us at Waitrose!","December 24, 2017",24 Comments5 Shares,321,waitroseandpartners
216,Hands up for perfect roasties! Why not try one of our recipes to make roast potatoes even more delicious: http://bit.ly/2C1ZBED,"December 23, 2017",680 Comments939 Shares579K Views,2K,waitroseandpartners
218,"For a scrumptious Christmas breakfast, try our hot smoked salmon on sourdough with smashed avocado. Finish with a dollop of chilli jam and sliced salad onions.
Full recipe: http://bit.ly/2C0mit0","December 22, 2017",485 Comments234 Shares400K Views,1.6K,waitroseandpartners
220,Beautiful stained glass cookies for a simple but impressive Christmas gift. Get the recipe: http://bit.ly/2iXUcXF,"December 19, 2017",412 Comments355 Shares340K Views,1.4K,waitroseandpartners
222,"Impress your guests this Christmas with the ultimate cheeseboard!
Shop our ultimate cheeseboard here: http://bit.ly/2BJXqq2","December 18, 2017",65 Comments24 Shares138K Views,379,waitroseandpartners
224,"WIN a magnum bottle of Laurent-Perrier Champagne for you and a friend to celebrate in style this festive season!
Simply comment below with photos or videos of how you’re enjoying #ChristmasTogether for a chance to win.
Terms and conditions: http://bit.ly/2hAIWn4","December 18, 2017",596 Comments68 Shares,522,waitroseandpartners
226,"Impress your guests this Christmas with the ultimate cheeseboard!
Shop our ultimate cheeseboard here: http://bit.ly/2BJXqq2","December 18, 2017",1.1K Comments562 Shares1.5M Views,4.8K,waitroseandpartners
228,"WIN the perfect dining table for you and a friend this Christmas. You’ll receive our ultimate dining set complete with glassware, crackers and even a WaitroseFlorist centrepiece.
For a chance to win, simply comments below with photos or videos of how you’re enjoying #ChristmasTogether.
Terms and conditions: http://bit.ly/2hAIWn4","December 12, 2017",401 Comments46 Shares,438,waitroseandpartners
230,"Which will you choose; our indulgent Mocha Cheesecake, fruity panna cotta or Heston’s Persian Spiced Pudding with a copper shimmer?
Discover our full range of chilled desserts in store and online from 13 December: http://bit.ly/2AMwS9Z","December 11, 2017",376 Comments292 Shares979K Views,2.7K,waitroseandpartners
232,"Three delicious vegan recipes that are packed with flavour. Get the full recipes below:
- Roasted aubergine, tomato and lemons and creamy cashew dressing: http://bit.ly/2BTjH4y
- Chocolate cherry tarts: http://bit.ly/2BJ6lqS...
See More","December 9, 2017","2.6K Comments1,105 Shares284K Views",1.9K,waitroseandpartners
